FlowerName,Image,Category,Amount,Description
,,,,
Grand Love 50 Rose Bouquet,images/GrandLove.jpg,Birthday,Rs.2895,"Introducing this exquisite bouquet of fifty Red Roses, a stunning declaration of love enveloped in pure white wrapping paper with sophisticated black borders. Each of these roses embodies the depth of your affection, unfolding gracefully like a love story in full bloom. This magnificent arrangement conveys what words alone cannot capture, expressing your heartfelt emotions in a gorgeous way. So, enchant your special someone with the eternal beauty of this bouquet, a symbol of your everlasting love."
Red Radiance Birthday Roses,images/RedRadiance.jpg,Birthday,Rs.645,"In the realm of timeless elegance, behold this breathtaking arrangement of ruby red roses, meticulously cradled in an exquisitely designed Happy Birthday box. Each rose, with its velvety texture and deep crimson hue, is a symbol of unspoken passion and enduring love. These roses, wrapped in a chic presentation, elevate the traditional birthday greeting to a gesture of refined sophistication and heartfelt emotion."
Soft Petals Unfolding Sunset Dreams,images/SoftPetals.jpg,Birthday,Rs.945,"Embrace the warmth with this Soft Petals Unfolding Sunset Dreams floral arrangement. This stunning flower arrangement features 8 vibrant red roses, 2 stems of cheerful yellow button daisies, and a touch of eucalyptus, all delicately wrapped in luxurious pink premium paper. Perfect for adding a pop of colour and charm to any occasion, it's a beautiful blend of passion, joy, and natural elegance. Surprise your loved ones by sending them a thoughtful gift or enjoy a perfect self-treat for moments that deserve to be remembered."
Lily Dreamland With Purple Daisy,images/LilyDreamland.jpg,Birthday,Rs.1995,"A stunning combination of 3 pink oriental lilies and 4 stems of purple daisies, this arrangement is a symbol of elegance and admiration. The bold pink lilies, with their striking blooms, are beautifully complemented by the soft purple daisies and lush green foliage, all arranged in a sophisticated vase. The glass vase adds a touch of luxury, making this a perfect centrepiece for any occasion. Whether celebrating an anniversary, expressing admiration, or simply adding a splash of sophistication to a space, this graceful vase arrangement is sure to leave a lasting impression."
Heart Full Of Roses,images/HeartFull.jpg,Best Sellers,Rs.895,"Surprise your special someone with this heart-shaped box of fiery red roses, the ultimate symbol of love and passion. Each bloom is carefully arranged to captivate the heart at first glance, making it a perfect gift for Valentine’s Day, anniversaries, or any romantic occasion. Presented in an elegant black box adorned with a red ribbon, this stunning arrangement speaks volumes of your affection. A gift so timeless and beautiful, it’s bound to leave your loved one feeling cherished and adored!"
Whispers Of Affection Pink Roses Bouquet,images/Whispers.jpg,Best Sellers,Rs.795,"A graceful ensemble of delicate pink roses, this bouquet is a symbol of admiration and gentle affection. Wrapped in luxurious pink paper with gold accents, this arrangement exudes sophistication and charm. The soft blush tones of the roses are beautifully highlighted by fresh green foliage, making this bouquet an elegant gift for expressing love, gratitude, or even admiration. Perfect for anniversaries, Mother’s Day, Friendship Day, or simply to brighten someone’s day, this bouquet offers a subtle yet powerful way to convey your deepest sentiments. Whether for a loved one or a dear friend, its magnificent design and gentle colour palette will surely leave a lasting impression."
Majestic Bouquet Of Roses,images/Majestic.jpg,Best Sellers,Rs.545,"This charming bouquet of 6 crimson red roses is wrapped in beautifully pleated red paper, complete with a delicate ribbon bow, adding a touch of elegance to the arrangement. The roses are paired with lush greenery and sprigs of golden-yellow fillers, giving the bouquet a vibrant and lively appearance. Perfect for celebrating romantic milestones such as anniversaries or for expressing love and appreciation on special occasions, this bouquet serves as a heartfelt gesture that speaks volumes. Its modern yet classic arrangement makes it an ideal gift for anyone who appreciates the beauty of simplicity mixed with passion."
Graceful Blush Of Pink Roses,images/Graceful.jpg,Best Sellers,Rs.1445,"Express your affection this Valentine’s Day with a delightful gift of 12 elegant pink roses. Symbolising admiration and gentle love, these fresh blooms are carefully arranged in a charming love-themed box, adding a touch of sophistication and thoughtfulness. Perfect for creating a romantic moments like Anniversary, Birthdays, and Valentine's Day gifting, this beautiful floral gift conveys your heartfelt emotions effortlessly. Make your special someone feel cherished and loved with this timeless and graceful presentation."
Graceful Blossoms Of Delight,images/Ggraceful.jpg,Anniversary,Rs.1295,"Presenting this bouquet that whispers elegance and charm! This delightful arrangement features delicate light pink gerberas, pristine white lilies, and a mix of soft white and pink roses, all beautifully set in a pink-tinted vase. The soft hues blend together to create a refreshing visual experience, perfect for brightening any space or occasion. Whether it's a gesture of love, appreciation, or simply to add beauty to your surroundings, this floral masterpiece is the ideal choice!"
Blue 6 Orchid Jute Bouquet,images/Blue6Orchid.jpg,Anniversary,Rs.845,"Immerse in the beauty of nature with this breathtaking bouquet of vibrant blue orchids. Wrapped in rustic jute, the contrast between the bold colours of the orchids and the earthy texture of the wrapping creates an eye-catching, unique look. The striking blue hues symbolise elegance, beauty, and admiration, making this bouquet the perfect gift for someone special. This arrangement exudes luxury and sophistication with a natural touch, ideal for birthdays, congratulations, or to convey your appreciation. Whether for a friend, partner, or family member, the exotic beauty of these orchids will leave a lasting impression of warmth and admiration."
10 Red Roses Bouquet,images/10Red.jpg,Anniversary,Rs.1995,"Radiating love and elegance, this gorgeous bouquet features 10 velvety red roses, each symbolising deep affection and passion. Wrapped in a soft, delicate paper, the vibrant red hues are perfectly complemented by fresh green leaves, creating a stunning contrast that speaks of romance and admiration. This bouquet conveys heartfelt emotions with grace and simplicity, ideal for gifting on occasions such as birthdays, anniversaries, and Valentine's Day or as a timeless expression of love. Whether it's to say ""I love you"" or to celebrate a special moment, these beautiful red roses will always leave a lasting impression."
A Rosy Blush Of Fresh Love,images/Arosy.jpg,Anniversary,Rs.1245,"This exquisite bridal bouquet brings together soft peach and pink roses, each bloom adorned with pearls, creating a blend of elegance and romance. The delicate Gypsums surrounding the roses add a dreamy, ethereal touch, while the pearls offer a hint of luxury. Wrapped in satin ribbons, this bouquet is perfect for brides seeking a harmonious balance of sweetness and sophistication. Its gentle hues and classic design make it an unforgettable complement to your special day, ensuring you walk down the aisle in style."
Softly Into Forever With Gypsums,images/SoftlyInto.jpg,Bouquet,Rs.745,"This elegant bridal bouquet of baby’s breath exudes simplicity and grace, perfect for the bride who appreciates understated beauty. Each delicate white bloom creates a cloud-like effect, offering a soft, romantic vibe. Wrapped in flowing ribbons, this bouquet symbolises purity and everlasting love, making it a charming choice for both traditional and modern weddings. Its lightweight and airy design adds a natural elegance, ensuring that the bouquet complements the bride’s look effortlessly on her special day."
Eternity White Roses Bouquet,images/EternityWhite.jpg,Bouquet,Rs.745,"This bouquet of pristine white roses exudes timeless beauty and grace. Wrapped in soft white paper, these stunning roses are a symbol of purity, innocence, and peace. The delicate green foliage adds a subtle contrast, enhancing the elegance of the arrangement. Perfect for expressing sympathy, celebrating new beginnings, or offering a thoughtful gift for weddings and anniversaries, this bouquet radiates simplicity and sophistication. Whether to convey heartfelt emotions or to brighten someone’s day, these white roses offer a timeless gesture of love and appreciation."
Roseate Elegance Bouquet,images/Roseate.jpg,Bouquet,Rs.1245,"A delicate creation of blushing beauty, this bouquet is an exquisite blend of allure and botanical splendour—the pink non-woven paper envelopes twenty sumptuous pink roses, their velvety petals unfurling in a tender embrace. Delicate white Gypso fillers adorn this marvellous creation, adding a touch of ethereal elegance. A magnificent arrangement that speaks of passion and grace, this bouquet is a stunning work of floral art that will leave you mesmerized."
Bellina Purple Orchid Bouquet,images/Bellina.jpg,Bouquet,Rs.795,"Indulge in the luxurious beauty of purple orchids gracefully wrapped in soft pink paper, creating a striking combination of elegance and vibrancy. The vivid purple blooms, set against lush green leaves, convey admiration, respect, and deep sentiments. Perfect for celebrations, congratulations, or expressing appreciation, this bouquet is an exotic gift that speaks of sophistication and refined beauty. Whether for a friend, colleague or loved one, these purple orchids will leave a lasting impression, symbolising grace and admiration in every petal."
Spellbinding Pink Splendor,images/Spellbinding.jpg,Love & Affection,Rs.1395,"Amidst a garden of splendid beauty lies a round wooden basket overflowing with twenty baby pink roses, delicately arranged with Licula Grandis Leaves. Each petal exudes a magnetic scent that sends one's senses into a dreamlike trance. The graceful basket, adorned with a handle, complements the alluring hues of the flowers, leaving one in awe of its timeless elegance. A floral masterpiece that embodies the essence of exoticism and evokes a sense of wonder and awe in the eyes of the beholder, making it a perfect gift!"
Luxuriant Floral Grandeur,images/Luxuriant.jpg,Love & Affection,Rs.745,"Astonish your senses with this captivating bouquet of 10 delicate pink carnations, each meticulously selected for its stunning beauty and mesmerizing charm. Adorned with delicate white Gypsophila, it oozes a timeless elegance that's hard to resist. Wrapped in delicate pink non-woven paper, this stunning bouquet is a bewitching gift that speaks volumes without saying a word. This bouquet is the perfect way to express your heartfelt emotions, whether for a special occasion or just because!"
Blushing Bouquet of Ballerina,images/Blushing.jpg,Love & Affection,Rs.1400,"This enchanting bouquet of 12 pink roses is a testament to nature's exquisite beauty. Delicately wrapped in soft pink non-woven paper, the roses boast petals that exquisitely captivate the eye with their supple texture and captivating hues. The bouquet is complemented with lush Kamini leaves, gracefully adding a layer of depth and texture to this magnetic arrangement. This bouquet is a sophisticated statement of love and appreciation, a remarkable gift that gracefully speaks of admiration and respect for the recipient."
Pink Opulence,images/PinkOpulence.jpg,Love & Affection,Rs.645,"Elegantly arranged in a sleek glass vase, this stunning display of 7 vibrant pink carnations embodies admiration and grace. The lush green leaves and delicate white baby's breath fillers perfectly complement the striking pink blooms, creating a visual masterpiece that brightens any room. Ideal for Mother's Day, birthdays, housewarmings, or as a gesture of appreciation, this vase arrangement is a symbol of love and admiration. The minimalist glass vase adds a modern touch, making this arrangement not only a gift but also a lasting decorative piece for any space."
Golden Rose Symphony Of Eternal Love,images/GoldenRose.jpg,Luxury Flowers,Rs.2195,"The perfect gift to send enchanting love, a symphony of 20 golden painted white roses and 15 ravishing red roses nestled in a sleek black heart-shaped box. Each bloom exudes elegance, their golden accents symbolizing timeless love and the red roses expressing deep passion. Presented in this exquisite arrangement, these roses become messengers of affection, wrapped in the mystery of a black box. A stunning blend of luxury and sentiment, this floral masterpiece transforms any occasion into a memorable celebration."
Snowy Dreams,images/SnowyDreams.jpg,Luxury Flowers,Rs.1695,"Introducing our gorgeous floral arrangement, a perfect blend of elegance and charm. This captivating arrangement features 8 pristine white roses, symbolising purity and love, paired with 8 delicate white carnations that exude admiration and grace. Complementing these are 3 stems of enchanting white daisies, adding a touch of innocence and joy. The flower box is artistically enhanced with black painted fern leaves, creating a striking contrast and sophisticated look. All these beautiful elements are thoughtfully arranged in a chic striped box and adorned with white paper, making it an ideal gift for any special occasion."
Enchanted Bloomscape,images/Enchanted.jpg,Luxury Flowers,Rs.2800,"In a mesmerising symphony of colors and fragrances, behold the enchanting allure of this exquisite floral ensemble. Delicate light pink roses whisper tales of romance, while verdant green button chrysanthemums exude vitality and hope. The captivating blue carnations symbolise true devotion, dancing alongside the ethereal limonium in a graceful waltz. Majestic eucalyptus leaves bring a touch of sophistication, while the loveliest Kamini flowers exude an otherworldly charm. Nestled within a sleek, black fish bowl, this arrangement embodies opulence and elegance, a divine gift to cherish those lovely moments forever."
Beautiful Blossoms Medley,images/Beautiful.jpg,Luxury Flowers,Rs.2145,"Elevate your space with our exquisite Floral Symphony in a stunning glass vase. Two graceful lilies stand tall, their pristine petals exuding timeless elegance. Five delicate pink roses add a touch of romance, their blush hues a testament to love. White daisies, with their pure and innocent charm, mingle with light pink daisies, imparting a soft and dreamy aura. Completing this harmonious arrangement, green button daisies offer a playful contrast. Together, this arrangement is a masterpiece of nature's beauty, a symphony of colors and textures that will brighten any room. Embrace the artistry of flowers with this enchanting composition."
Mystical Blooming Affection,images/Mystical.jpg,Occasions,Rs.545,"Capture the essence of love with this exquisite bouquet of 10 radiant Pink Gerberas, tastefully wrapped in Pink Non-Woven Paper. Symbolic of passion and affection, this magical bouquet is perfect for expressing your deepest emotions to your special someone. Adorned with delicate White Gypso fillers, this enchanting floral masterpiece exudes elegance and charm. Let the vibrant colors and enchanting fragrance of this magical bouquet convey your heartfelt emotions to your loved ones. Order now and experience the enchanting aura of this captivating floral wonder!"
Sunshine Gerberas For Celebration,images/Sunshine.jpg,Occasions,Rs.645,"A symbol of cheer and hope, this bouquet of vivid yellow gerberas is beautifully wrapped in a matching yellow paper, bringing out the brightness of each bloom. The sunny gerberas, paired with lush green leaves, create a bouquet that is as refreshing as a sunrise. Ideal for friendship day, birthdays, housewarmings, or celebrating any joyous moment, these golden blooms are perfect for lifting spirits and spreading warmth. Whether for a friend or loved one, this bouquet conveys a message of happiness and good times ahead."
Merry Times,images/MerryTimes.jpg,Occasions,Rs.1450,"Happy times are here again and you are all set to celebrate. Make merry times even merrier with this picturesque arrangement of 8 pink carnations, 8 white roses and 4 orchids artistically put-together in an oval basket. Green foliage adds another shade of life to it. Present this basket full of love and compassion to the one who brings a happy moment to you."
Pleasant Poetic Petals,images/Pleasant.jpg,Occasions,Rs.1245,"A symphony of nature’s finest blooms, Pleasant Poetic Petals is a delicate embrace of fragrance, color, and charm. Each petal whispers a soft verse, swaying gently in the breeze like poetry woven into the garden of life. From the tender blush of roses to the starry glow of jasmine, every bloom tells a story of love, serenity, and renewal.

Bathed in golden sunlight and kissed by the morning dew, these petals are more than just flowers—they are fragments of dreams, blooming in hues of passion, hope, and tranquility. Their fragrance lingers like a sweet memory, filling the air with warmth and wonder.

Let Pleasant Poetic Petals inspire your heart, awaken your senses, and invite you into a world where nature’s beauty sings in harmony with the soul. "
Roses,images/Roses.jpg,Routine Flower,Rs.200,"Roses are woody flowering plants of the genus Rosa, known for their fragrant blooms and thorny stems. They come in various colors, including red, pink, white, yellow, and more, each symbolizing different emotions. Roses are widely used in gardens, bouquets, perfumes, and medicinal products due to their beauty and fragrance."
Jasmine,images/Jasmine.jpg,Routine Flower,Rs.450,"Jasmine (Jasminum) is a fragrant flowering plant with delicate white, yellow, or pink blossoms. Known for its sweet, intoxicating scent, it is widely used in perfumes, teas, and essential oils. Jasmine symbolizes love, purity, and good luck in many cultures. It can grow as a vine, shrub, or ground cover, making it a versatile choice for gardens, balconies, and indoor spaces."
Lily,images/Lily.jpg,Routine Flower,Rs.500,"Lilies (Lilium genus) are graceful, trumpet-shaped flowers that come in a variety of colors, including white, orange, pink, yellow, and red. They are known for their fragrance and elegance, symbolizing purity, renewal, and devotion. Lilies are popular in gardens, floral arrangements, and religious ceremonies."
Lotus,images/Lotus.jpg,Routine Flower,Rs.300,"Lotus (Nelumbo nucifera) is a sacred aquatic plant known for its large, round leaves and stunning pink or white flowers that bloom above the water. It symbolizes purity, enlightenment, and spiritual awakening in many cultures, particularly in Buddhism and Hinduism. Lotus plants thrive in warm, tropical, and subtropical climates and are widely used in water gardens, ponds, and cultural ceremonies."
Periwinkle,images/Periwinkle.jpg,Routine Flower,Rs.550,"Periwinkle (Vinca) is a low-growing evergreen plant known for its delicate blue, purple, pink, or white flowers. It is often used as a ground cover due to its spreading habit and resistance to tough conditions. Periwinkle symbolizes everlasting love and remembrance and is valued in landscaping for its drought tolerance and easy maintenance."
